<?xml version="1.0" encoding="UTF-8"?>
<xs:schema xmlns:xs="http://www.w3.org/2001/XMLSchema" elementFormDefault="qualified" attributeFormDefault="unqualified">
	<xs:element name="dafifLoaderConfiguration">
		<xs:annotation>
			<xs:documentation>Configuration file for TLcdDAFIFLoader</xs:documentation>
		</xs:annotation>
		<xs:complexType>
			<xs:sequence>
				<xs:element name="dafifTypes" type="DAFIFTypes"/>
			</xs:sequence>
		</xs:complexType>
	</xs:element>

	<xs:complexType name="DAFIFTypes">
    <xs:sequence>
      <xs:element name="type" minOccurs="0" maxOccurs="unbounded">
		    <xs:complexType>
          <xs:sequence>
            <xs:element name="name" type="xs:string"/>
            <xs:element name="decoderClass" type="xs:string"/>
          </xs:sequence>
        </xs:complexType>
      </xs:element>
    </xs:sequence>
	</xs:complexType>
</xs:schema>
