<?xml version="1.0" encoding="UTF-8"?>
<!--
DAFIF Edition 7 Loader configuration
-->
<dafifLoaderConfiguration xmlns:xsi="http://www.w3.org/2001/XMLSchema-instance" xsi:noNamespaceSchemaLocation="dafifLoader.xsd">
  <dafifTypes>
    <type>
      <name>Aerodrome</name>
      <decoderClass>com.luciad.format.dafif.decoder.TLcdDAFIFAerodromeDecoder</decoderClass>
    </type>
  </dafifTypes>
  <dafifTypes>
    <type>
      <name>Airspace</name>
      <decoderClass>com.luciad.format.dafif.decoder.TLcdDAFIFAirspaceDecoder</decoderClass>
    </type>
  </dafifTypes>
  <dafifTypes>
    <type>
      <name>Navaid</name>
      <decoderClass>com.luciad.format.dafif.decoder.TLcdDAFIFNavaidDecoder</decoderClass>
    </type>
  </dafifTypes>
  <dafifTypes>
    <type>
      <name>Special Use Airspace</name>
      <decoderClass>com.luciad.format.dafif.decoder.TLcdDAFIFSpecialUseAirspaceDecoder</decoderClass>
    </type>
  </dafifTypes>
  <dafifTypes>
    <type>
      <name>ATS Route</name>
      <decoderClass>com.luciad.format.dafif.decoder.TLcdDAFIFIndependentATSRouteDecoder</decoderClass>
    </type>
  </dafifTypes>
  <dafifTypes>
    <type>
      <name>Runway</name>
      <decoderClass>com.luciad.format.dafif.decoder.TLcdDAFIFIndependentRunwayDecoder</decoderClass>
    </type>
  </dafifTypes>
  <dafifTypes>
    <type>
      <name>Heliport</name>
      <decoderClass>com.luciad.format.dafif.decoder.TLcdDAFIFHeliportDecoder</decoderClass>
    </type>
  </dafifTypes>
  <dafifTypes>
    <type>
      <name>Helipad</name>
      <decoderClass>com.luciad.format.dafif.decoder.TLcdDAFIFIndependentHelipadDecoder</decoderClass>
    </type>
  </dafifTypes>
  <dafifTypes>
    <type>
      <name>Holding</name>
      <decoderClass>com.luciad.format.dafif.decoder.TLcdDAFIFIndependentHoldingDecoder</decoderClass>
    </type>
  </dafifTypes>
  <dafifTypes>
    <type>
      <name>ILS</name>
      <decoderClass>com.luciad.format.dafif.decoder.TLcdDAFIFIndependentILSDecoder</decoderClass>
    </type>
  </dafifTypes>
  <dafifTypes>
    <type>
      <name>Procedure</name>
      <decoderClass>com.luciad.format.dafif.decoder.TLcdDAFIFIndependentProcedureDecoder</decoderClass>
    </type>
  </dafifTypes>
  <dafifTypes>
    <type>
      <name>Military Training Route</name>
      <decoderClass>com.luciad.format.dafif.decoder.TLcdDAFIFMilitaryTrainingRouteDecoder</decoderClass>
    </type>
  </dafifTypes>
  <dafifTypes>
    <type>
      <name>Ortca</name>
      <decoderClass>com.luciad.format.dafif.decoder.TLcdDAFIFOrtcaDecoder</decoderClass>
    </type>
  </dafifTypes>
  <dafifTypes>
    <type>
      <name>Parachute Jump Area</name>
      <decoderClass>com.luciad.format.dafif.decoder.TLcdDAFIFParachuteJumpAreaDecoder</decoderClass>
    </type>
  </dafifTypes>
  <dafifTypes>
    <type>
      <name>Refueling Track</name>
      <decoderClass>com.luciad.format.dafif.decoder.TLcdDAFIFRefuelingTrackDecoder</decoderClass>
    </type>
  </dafifTypes>
  <dafifTypes>
    <type>
      <name>VFR</name>
      <decoderClass>com.luciad.format.dafif.decoder.TLcdDAFIFVFRRouteDecoder</decoderClass>
    </type>
  </dafifTypes>
  <dafifTypes>
    <type>
      <name>Waypoint</name>
      <decoderClass>com.luciad.format.dafif.decoder.TLcdDAFIFWayPointDecoder</decoderClass>
    </type>
  </dafifTypes>
  <dafifTypes>
    <type>
      <name>Airport-Navaid</name>
      <decoderClass>com.luciad.format.dafif.decoder.TLcdDAFIFIndependentAerodromeNavaidDecoder</decoderClass>
    </type>
  </dafifTypes>

</dafifLoaderConfiguration>
