<?xml version="1.0" encoding="UTF-8"?>
<!--
DAFIF Edition 8 Loader configuration
 -->
<dafifLoaderConfiguration xmlns:xsi="http://www.w3.org/2001/XMLSchema-instance" xsi:noNamespaceSchemaLocation="dafifLoader.xsd">
  <dafifTypes>
    <type>
      <name>Aerodrome</name>
      <decoderClass>com.luciad.format.dafift.decoder.TLcdDAFIFTAerodromeDecoder</decoderClass>
    </type>
  </dafifTypes>
  <dafifTypes>
    <type>
      <name>Airspace</name>
      <decoderClass>com.luciad.format.dafift.decoder.TLcdDAFIFTAirspaceDecoder</decoderClass>
    </type>
  </dafifTypes>
  <dafifTypes>
    <type>
      <name>Navaid</name>
      <decoderClass>com.luciad.format.dafift.decoder.TLcdDAFIFTNavaidDecoder</decoderClass>
    </type>
  </dafifTypes>
  <dafifTypes>
    <type>
      <name>Special Use Airspace</name>
      <decoderClass>com.luciad.format.dafift.decoder.TLcdDAFIFTSpecialUseAirspaceDecoder</decoderClass>
    </type>
  </dafifTypes>
  <dafifTypes>
    <type>
      <name>ATS Route</name>
      <decoderClass>com.luciad.format.dafift.decoder.TLcdDAFIFTIndependentATSRouteDecoder</decoderClass>
    </type>
  </dafifTypes>
  <dafifTypes>
    <type>
      <name>Runway</name>
      <decoderClass>com.luciad.format.dafift.decoder.TLcdDAFIFTIndependentRunwayDecoder</decoderClass>
    </type>
  </dafifTypes>
  <dafifTypes>
    <type>
      <name>Heliport</name>
      <decoderClass>com.luciad.format.dafift.decoder.TLcdDAFIFTHeliportDecoder</decoderClass>
    </type>
  </dafifTypes>
  <dafifTypes>
    <type>
      <name>Helipad</name>
      <decoderClass>com.luciad.format.dafift.decoder.TLcdDAFIFTIndependentHelipadDecoder</decoderClass>
    </type>
  </dafifTypes>
  <dafifTypes>
    <type>
      <name>Holding</name>
      <decoderClass>com.luciad.format.dafift.decoder.TLcdDAFIFTIndependentHoldingDecoder</decoderClass>
    </type>
  </dafifTypes>
  <dafifTypes>
    <type>
      <name>ILS</name>
      <decoderClass>com.luciad.format.dafift.decoder.TLcdDAFIFTIndependentILSDecoder</decoderClass>
    </type>
  </dafifTypes>
  <dafifTypes>
    <type>
      <name>Procedure</name>
      <decoderClass>com.luciad.format.dafift.decoder.TLcdDAFIFTIndependentProcedureDecoder</decoderClass>
    </type>
  </dafifTypes>
  <dafifTypes>
    <type>
      <name>Military Training Route</name>
      <decoderClass>com.luciad.format.dafift.decoder.TLcdDAFIFTMilitaryTrainingRouteDecoder</decoderClass>
    </type>
  </dafifTypes>
  <dafifTypes>
    <type>
      <name>Ortca</name>
      <decoderClass>com.luciad.format.dafift.decoder.TLcdDAFIFTOrtcaDecoder</decoderClass>
    </type>
  </dafifTypes>
  <dafifTypes>
    <type>
      <name>Parachute Jump Area</name>
      <decoderClass>com.luciad.format.dafift.decoder.TLcdDAFIFTParachuteJumpAreaDecoder</decoderClass>
    </type>
  </dafifTypes>
  <dafifTypes>
    <type>
      <name>Refueling Track</name>
      <decoderClass>com.luciad.format.dafift.decoder.TLcdDAFIFTRefuelingTrackDecoder</decoderClass>
    </type>
  </dafifTypes>
  <dafifTypes>
    <type>
      <name>VFR</name>
      <decoderClass>com.luciad.format.dafift.decoder.TLcdDAFIFTVFRRouteDecoder</decoderClass>
    </type>
  </dafifTypes>
  <dafifTypes>
    <type>
      <name>Waypoint</name>
      <decoderClass>com.luciad.format.dafift.decoder.TLcdDAFIFTWayPointDecoder</decoderClass>
    </type>
  </dafifTypes>
  <dafifTypes>
    <type>
      <name>Airport-Navaid</name>
      <decoderClass>com.luciad.format.dafift.decoder.TLcdDAFIFTIndependentAerodromeNavaidDecoder</decoderClass>
    </type>
  </dafifTypes>

</dafifLoaderConfiguration>
